nome,sku,quantidade,total,porcentagem_das_vendas
"Produto GRÁTIS SURPRESA",3JCD48NXJ,199,0,0
"Óleo de limpeza facial ANUA Heartleaf Pore Control Cleansing Oil 200ml",3KXS82PFK,57,13469.84,2.04
"Sérum facial com PDRN Medicube Pink Peptide Serum 30ml",NLV5N28RJ,50,16572.5,2.51
"Kit com 4 clipes de cabelo",NHYN9WYW4,39,0,0
"Creme p/ olhos com retinol Beauty of Joseon Revive Eye Serum Ginseng + Retinal 30ml",YRGGCCZV4,38,7005.79,1.06
"Sérum facial COSRX Advanced Snail 96 Mucin Power Essence 100ml",P98CUPDN7,38,7541.51,1.14
"Tônico facial Medicube Deep Vita C Toner Pads",YCAFY5PDC,35,7324.66,1.11
"Hidratante Cosrx Advanced Snail 92 All In One Cream 100ml",NATQVCF5U,34,6963.28,1.05
"Creme facial hidratante com Vitamina C Medicube Deep Vita C Capsule Cream Vitamin Golden Boba 55g",PXJL6QVSC,32,11786,1.78
"Sérum facial VT Cosmetics Reedle Shot 100 300 700 Essence 50ml 100 microagulhas",86NNKQTS9,31,8483.42,1.28
"Sérum facial Numbuzin Nº 5+ Glutathione Vitamin Concentrated Serum 30ml",KVVWTPH6S,31,7531.5,1.14
"Máscara facial de Colágeno Biodance Bio-Collagen Real Deep Sheet Mask Hydrating Overnight 4 unidades",DRB5K3JVM,29,5937.22,0.9
"Tônico facial MEDICUBE Zero Pore Pad 2.0 Toner Pad",JPXLRJGCN,28,8386.68,1.27
"Sérum Beauty of Joseon Glow Deep Serum Rice + Alpha-Arbutin 30ml",FB8ZGB6ZV,27,4980.25,0.75
"Máscara facial de colágeno Medicube Collagen Night Wrapping Mask 75ml",D5585GUJ4,27,9122.27,1.38
"Massageador facial Gua sha de jade natural",6ESFXKEA6,26,0,0
"Protetor solar Beauty of Joseon Relief Sun Rice Probiotics SPF50+ PA++",RKVH5XSYP,25,4823.54,0.73
"Máscara para olhos de colágeno Abib Collagen Eye Patch Jericho Rose Jelly",SLZH25857,24,5251.95,0.79
"Protetor solar em bastão Beauty of Joseon Matte Sun Stick Mugwort+Camelia SPF 50+ PA++++ 18g",EXZTPZFG2,24,4680,0.71
"Protetor solar Round Lab Birch Juice Moisturizing Sun Cream SPF50+ PA++++ 50ml",MYG76GE5X,23,4239.9,0.64
"Creme p/ Melasma Melanon X Cream Medi-Peel 30ml",NBC6G9BGY,22,3542.91,0.54
"Sérum facial com microagulhas Medicube Zero Exosome Shot 2000ppm e 7500ppm 30ml 2000ppm",65YSDXPJS,22,6078,0.92
"Tônico facial Numbuzin 5+ Vitamin Boosting Glutathione Essential Toner 200ml",HBJVNM35P,22,4415.69,0.67
"Óleo de limpeza facial SKIN1004 Madagascar Centella Light Cleansing Oil 200ml",DJRUYMC2K,22,5099.34,0.77
"Máscara capilar Shiseido Fino Premium Touch Penetration Essence Hair Mask 230g",XJSEGUGH9,21,4775.68,0.72
"Protetor solar em bastão Abib Airy Sunstick Smoothing Bar SPF50+ PA++++",GFJHHN89L,20,4528.93,0.69
"Tônico facial com PDRN de salmão Medicube PDRN Pink Cica Soothing Toner 250ml",GGQ2SHPQ3,20,6804.36,1.03
"Creme p/ olhos Some By Mi Retinol Intense Advanced Triple Action Eye Cream 30ml",JW2G2HXGL,20,4087.98,0.62
"Creme p/ olhos COSRX Advanced Snail Peptide Eye Cream 25ml",W4AFDREZF,19,4532.37,0.69
"Sérum facial Numbuzin Nº 3 Skin Softening 50ml",DHEFFLZEX,19,4363.42,0.66
"Máscara facial c/ PDRN e colágeno Medicube Pink PDRN Collagen Gel Mask 30g 3 unidades",M2QQ8GGS3,19,5322,0.81
"Sérum facial VT Cosmetics PDRN 100 Essence 30ml",TU5276RRB,18,6354.3,0.96
"Máscara facial c/ PDRN e colágeno Medicube Pink PDRN Collagen Gel Mask 30g 1 unidade",3Z6PAYU2Y,18,1800,0.27
"Tônico The Ordinary Ácido Glicólico Glycolic Acid 7% Toning Solution 240ml",NPBYGL48F,18,4176.4,0.63
"Máscara facial de Colágeno Biodance Bio-Collagen Real Deep Sheet Mask Hydrating Overnight 1 unidade",N9ZDQY8FD,18,1440.2,0.22
"Máscara Labial noturna Lip Sleeping Mask Berry 20g",WNCNBG3QA,18,2554.8,0.39
"Sérum Beauty of Joseon Revive Ginseng + Snail Mucin",577D36WQP,18,3209.58,0.49
"Tônico facial de arroz Beauty of Joseon Glow Replenishing Rice Milk 150ml",DZKW7W278,18,4075.98,0.62
"Sérum facial com centela asiática Ampola Facial SKIN1004 Madagascar Centella Ampoule 100ml",RUSQDMH9Y,18,5024.44,0.76
"Máscara facial Beauty of Joseon Red Bean Refreshing Pore Mask 140ml",9X5HP5SYQ,17,4465.02,0.68
"Tônico facial Anua Heartleaf 77% Soothing Toner 250ml",WH22QEXV5,17,3757.5,0.57
"Pó facial Laneige Neo Essential Blurring Finish Powder 7g",BJUJP2WY2,17,4076.88,0.62
"Sérum Facial com Vitamina C Melano CC Essence",6CXTRDU6Q,17,1675.9,0.25
"Sérum facial em ampola com peptídeos e PDRN Medicube PDRN Pink One Day Serum 1,5mlx10un",UNPMQTE37,17,3761.16,0.57
"Máscara labial e facial noturna Laneige Lip Sleeping Mask Berry 3g",CVUBCWGAL,17,900.4,0.14
"Sérum facial com microagulhas Medicube Zero Exosome Shot 2000ppm e 7500ppm 30ml 7500ppm",3RGUPN6JQ,17,6415.92,0.97
"Espuma de limpeza facial Anua Heartleaf Quercetinol Pore Deep Cleansing Foam 150ml",QZXVY26ML,16,3360,0.51
"Creme hidratante facial Beauty of Joseon Dynasty Cream 50ml",SF9WBEF2N,16,3676.57,0.56
"Tônico facial Numbuzin Nº 5+ Vitamin Niacinamide Concentrated Toner Pad 180ml",K47RBVLZ4,16,4368.76,0.66
"Ampola Facial SKIN1004 Madagascar Centella Tone Brightening Capsule Ampoule 100ml 100ml",7GTRPHN6R,16,4267.6,0.65
"Sérum facial Missha Time Revolution Night Repair Ampoule 5X 70ml",GXDDABERX,16,3970.33,0.6
"Sérum facial de soja fermentada Mixsoon Bean Essence 50ml",T2XUA3RPV,15,4145,0.63
"Tratamento capilar de colágeno Elizavecca Cer-100 Collagen Coating Hair Protein Treatment 50ml",UN3ERDYED,15,1667.5,0.25
"Sérum facial COSRX The 6 Peptide Skin Booster Serum 150ml",EKMJNPCWX,15,4179.75,0.63
"Creme hidratante facial Dr.G Red Blemish Clear Soothing Cream 70ml",PGGJNDJW6,14,2741.48,0.41
"Creme p/ área dos olhos SKIN1004 Madagascar Centella Probio-Cica Bakuchiol Eye Cream 20ml",2S5LERB8W,14,2880.82,0.44
"Tônico facial I'm From Rice Toner 150ml",YNCQLM6PW,14,3415.63,0.52
"Sérum facial p/ manchas ANUA Niacinamide 10% + Txa 4% Dark Spot Correcting Serum",8W6MER7VG,14,3599.3,0.54
"Espuma de limpeza facial p/ poros Medicube Zero Foam Cleanser 120g",DE3B67D4D,14,2570.71,0.39
"Creme hidratante facial para poros Medicube Zero Pore One Day Cream 30ml",KWAF7V3CG,14,5197.03,0.79
"Creme facial hidratante com ácido hialurônico e PDRN Medicube PDRN Pink Hyaluronic Moisturizing Cream 50ml",XGQRCVZ2C,14,4711.86,0.71
"Máscara facial de arroz Beauty of Joseon Ground Rice and Honey Glow Mask 150ml",LXYG774M9,14,3465.42,0.52
"Máscara facial SKIN1004 Madagascar Centella Poremizing Quick Clay Stick 27g",A3FXNCDTC,14,3345.08,0.51
"Sérum facial com centela asiática Ampola Facial SKIN1004 Madagascar Centella Ampoule 55ml",RSXQUK8QZ,13,2583.04,0.39
"Sérum facial Medicube AGE-R Glutathione Glow Ampole Serum 50ml",2QTHRUAVC,13,3643,0.55
"Sérum facial VT Cosmetics Reedle Shot 100 Essence Ampola 6ml 7 ampolas",DVUYCQFFV,13,1824.08,0.28
"Creme hidratante facial SKIN1004 Madagascar Centella Poremizing Light Gel Cream 75ml",ZRJAPUUEC,13,2816,0.43
"Creme facial hidratante anti-idade Sulwhasoo Concentrated Ginseng Renewing Cream Classic 10ml",6ASZPW5U4,13,2282.4,0.35
"Sérum Beauty of Joseon Glow Propolis + Niacinamida",P2NMRWDCC,13,2442.2,0.37
"Espuma de limpeza facial Round Lab 1025 Dokdo Cleanser 150g",8V72K376Z,13,2338.43,0.35
"Sérum facial VT Cosmetics Reedle Shot 100 300 700 Essence 50ml 300 microagulhas",GJMY8SXDD,12,3732,0.56
"Ampola Facial SKIN1004 Madagascar Centella Poremizing Fresh Ampoule 100ml 100ml",K2HVHHUWK,12,3174.3,0.48
"Sérum facial para poros Medicube Zero Pore One Day Serum 30ml",EEF2Y45F4,12,4236.2,0.64
"Creme hidratante para pescoço com colágeno e retinol CKD Retino Collagen Molecule 300 Guasha Neck Cream 50ml Creme c/ guasha",MCYDLTJZF,12,2543.98,0.38
"Tônico facial Numbuzin Nº3 Radiance Glowing Jumbo Essence Toner Pad",F23EALBGP,11,3024.67,0.46
"Sérum facial Some by Mi Retinol Intense Reactivating 30ml",GASHXD556,11,2859.1,0.43
"Base Cushion TIRTIR Mask Fit Red Cushion 18g e Mini 4.5g 18g 23N (Areia)",G2R9GR3BN,11,3926.34,0.59
"Frasco pump de coração p/ sabonete facial",7FYNWY6N7,11,0,0
"Máscara facial Collagen Niacinamide Jelly Cream 110ml",ZRXLVTES2,11,3847.93,0.58
"Tônico facial Beauty of Joseon Ginseng Essence Water 150ml",CM65FBPHF,11,2419.1,0.37
"Creme hidratante antienvelhecimento Medi-Peel Peptide 9 Volume & Tension Tox Cream Pro 50g",JBNL593UX,10,2106.8,0.32
"Sérum facial Manyo Bifida Biome Complex Ampoule 50ml",9TMYD238A,10,2163.6,0.33
"Fixador de maquiagem TIRTIR Mask Fit Make Up Fixer 80ml",VGRB47NEG,10,1832,0.28
"Sérum facial The Ordinary AHA 30% + BHA 2% Peeling Solution 30ml",WEYEP3FB4,10,1666.32,0.25
"Protetor solar líquido Beauty of Joseon Relief Sun Aqua Fresh SPF50+ PA++ 50ml",Q9ZQSU7X4,10,2398,0.36
"Sérum facial VT Cosmetics Reedle Shot 100 300 700 Essence 50ml 700 microagulhas",V48JHU8L4,10,4577.09,0.69
"Gel de limpeza facial Some by Mi Bye Bye Blackhead 30 Days Miracle Green Tea Bubble Cleanser 120ml",ASRS7UWVE,10,1998,0.3
"Máscara facial Etude House 0.2 Therapy Air Sheet Mask 20g Aloe",LN2TTZ3V4,10,62.99,0.01
"Creme facial SKIN1004 Madagascar Centella Probio-Cica Enrich Cream 50ml",EDHHKF5ZV,10,2759.82,0.42
"Loção hidratante facial Anua Heartleaft 70% Daily Lotion 200ml",ZMMLLYNWA,10,2049.38,0.31
"Sérum p/ olhos redutor de olheiras AXIS-Y Vegan Collagen Eye Serum 10ml",2NZACRY22,10,2723.09,0.41
"Protetor solar líquido Numbuzin Nº1 Clear Filter Sun Essence SPF50+ PA++++ 50ml",3SCXKLFAB,9,1703.2,0.26
"Sérum facial AXIS-Y Dark Spot Correcting Glow Serum 50ml",DUKWQK82V,9,1695.91,0.26
"Tônico facial Anua Heartleaf 77% Soothing Toner 500ml",NJM7BEQ28,9,2799.6,0.42
"Tônico facial Anua Heartleaf 77% Clear Toner Pad 160ml",XHU3CVZWT,9,1954.9,0.3
"Kit Teste TIRTIR Mask Fit Red Cushion Foundation Cushion com 1g 6 sachês Light Medium (21C á 24W)",R6J87E6V4,9,1430.32,0.22
"Sérum para cílios Etude House My Lash Serum 18g",CDKDDM2TT,9,968.88,0.15
"Sérum de retinol Medicube Retinol NMN Boosting Serum 30ml",9KQEGZUP9,9,3392.13,0.51
"Tônico facial clareador com glutationa Medicube Glutathione Glow Toner 140ml",V54Q49HN8,8,2502.91,0.38
"Creme hidratante facial Some by Mi AHA BHA PHA 30 Days Miracle Cream 50ml",CKPM94AYY,8,1559.6,0.24
"Importação Xpress (Receba antes dos 50 dias úteis)",H7YBR3ZAQ,8,1200,0.18
"Óleo de limpeza facial Numbuzin nº 1 Easy Peasy Cleansing Oil 200ml",HLASSP643,8,1633.3,0.25
"Tônico facial clareador com glutationa Medicube Glutathione Glow Toner 140ml",V54Q49HN8,8,2502.91,0.38
"Creme hidratante facial Some by Mi AHA BHA PHA 30 Days Miracle Cream 50ml",CKPM94AYY,8,1559.6,0.24
"Protetor solar em bastão Abib Quick Sunstick Protection Bar SPF50+ PA++++",N56HGXTNR,8,1745.3,0.26
"Creme hidratante facial NEOGEN High R Exosome Cream 40ml",C6BVWLF5R,8,1554.55,0.24
"Sérum facial com retinal Celimax The Vita-A Retinal Shot Tightening Booster 15ml",YAHFXZ6NE,8,1739.42,0.26
"Ampola Facial SKIN1004 Madagascar Centella Probio-Cica Intensive Ampoule 100ml",GGY86NS8C,8,2419.2,0.37
"Óleo de limpeza facial Manyo Pure Cleansing Oil 200ml",Z36AHQT4R,7,1444.32,0.22
"Sérum facial de niacinamida ANUA Peach 70 Niacin Serum 30ml",RJX542CZJ,7,1579.14,0.24
"Kit Shampoo Condicionador e Máscara capilar Mise En Scene Perfect Serum 680mlx330ml Kit completo",2YGBTQ6RM,7,5314.2,0.8
"Creme p/ olhos e rosto com Vitamina C Goodal Green Tangerine Vita C Cream 40ml",TA2ZBGUFF,7,667.67,0.1
"Primer Dr. G Pore Blur Up Sun SPF 50+ PA++++ 50ml",T3VTFBP84,7,1184.94,0.18
"Pó de limpeza facial de Arroz e Ceramidas Anua Rice Enzyme Brightening Cleansing Powder 40g",HQT74LD7T,7,2099.23,0.32
"Creme p/ olhos com PDRN e peptídeos Medicube PDRN Pink Peptide Eye Cream 30ml",9ND9STSGV,7,1444.2,0.22
"Base Cushion TIRTIR Mask Fit Red Cushion 18g e Mini 4.5g 18g 21N (Marfim)",EH56SJWAQ,7,2443.76,0.37
"Sérum facial SKIN1004 Madagascar Centella Hyalu-Cica Blue Serum 50ml",G5Y665XL5,7,1578.8,0.24
"Gel de limpeza facial Cosrx Low PH Good Morning Gel Cleanser 150ml",MMRNN4STS,7,1265.66,0.19
"Creme hidratante facial History of Whoo Gongjinhyang Soo Vital Hidrating Cream 50ml",T6V8VEYZW,7,3839.36,0.58
"Dispositivo removedor de cravos e espinhas ILSO Deep Clean Master Blackhead Remover Tool",HYW4AXS32,7,1445.25,0.22
"Máscara facial de arroz I'm From Rice Mask 110g",8M3RAYC6Z,7,1425,0.22
"Sérum facial de peptídeos Medipeel Peptide9 Volume Bio Tox Ampoule Pro 100ml",HW488757F,7,1928.7,0.29
"Creme p/ olhos com Ácido Tranexâmico Mary&May Tranexamic Acid+Glutathion Eye Cream 12ml",8KXTTB26U,7,819.8,0.12
"Sérum facial calmante com ácido azeláico Medicube Azelaic Acid 16 BB Calming Serum 30ml",CP5SCQB7Z,7,2303,0.35
"Máscara facial de colágeno Medicube Collagen Lifting Mask 30g 3 unidades",LSL85MWJU,7,1050,0.16
"Sérum facial The Ordinary Retinol 1% in Squalane 30ml",B6NCJSZ44,6,1195.6,0.18
"Tônico facial Numbuzin Nº 3 Super Glowing Essence Toner 200ml",3QNUNJ2HV,6,1335.13,0.2
"Protetor solar Missha All-Around Safe Block Sunscream SPF45/50 Pa+++ 50ml e 70ml Soft Finish",6QTH3RT9X,6,1005.6,0.15
"Bálsamo de limpeza facial House of Hur Purifying Cleansing Balm 50ml",GPSR5SNTU,6,1221.2,0.18
"Máscara capilar reparadora Shiseido Tsubaki Premium Repair Mask 180g",TSPSXDTLG,6,1376.08,0.21
"Sérum facial com PDRN Anua PDRN Hyaluronic Capsule 100+ Serum 30ml",K365E6V44,6,2100,0.32
"Creme facial Cosrx Hydrium Moisture Power Enriched Cream 50ml",69XVAAEJG,6,1382.4,0.21
"Bruma facial clareadora com PDRN Medicube PDRN Pink Glutathione Serum Mist 100ml",2LTLDZ78M,6,1566,0.24
"Máscara facial Missha Airy Fit Sheet Mask Arroz (Rice)",JZ9A338FF,6,299.4,0.05
"Sabonete facial Shiseido Senka Perfect Whip Foam 120g",7NS8G7LD7,6,1029.45,0.16
"Sérum facial com Vitamina C Beauty of Joseon Light On Serum Centella + Vita C 30ml",4ZR79DZV8,6,1125.06,0.17
"Sérum facial com microagulhamento e colágeno Medicube PDRN Pink Collagen Exosome Shot Ampoule 2000 e 7500 30ml 2000ppm",PZDFKRVJJ,6,2148.56,0.33
"Máscara facial de colágeno Medicube Collagen Lifting Mask 30g 1 unidade",S8J8PZRWR,6,267,0.04
"Ampola Facial SKIN1004 Madagascar Centella Tea-Trica Relief Ampoule 100ml 100ml",4G5SSZEQ7,6,1798.8,0.27
"Sérum facial para manchas com ácido tranexâmico Medicube TXA Niacinamide 15 Serum 30ml",C8BBJ32RJ,6,2092.82,0.32
"Sérum facial para melasma e rugas MEDI-PEEL Melanon X Ampoule Serum 50ml",Z4CN8K4GZ,6,1452.6,0.22
"Sérum facial VT Cosmetics Reedle Shot 100 Essence 50ml",ACPTEB3L5,6,1054.2,0.16
"Sérum facial Medicube Age-R Booster Gel 100ml",M2CR57BCZ,6,1734,0.26
"Protetor solar físico SKIN1004 Madagascar Centella Air-Fit Suncream 50ml",2CKDMNKMQ,6,1135.96,0.17
"Bálsamo de limpeza facial Dr.Althea Pure Grinding Cleansing Balm 50ml",EX9YC95YS,6,1463.8,0.22
"Sérum facial com PDRN Genabelle PDRN Vita Toning Ampoule 30ml",J5B74QPZT,6,1623.44,0.25
"Sérum facial de cafeina The Ordinary Caffeine Solution 5% + EGCG 30ml",A3GAHTZCK,5,1095,0.17
"Espuma de limpeza facial para acne SKIN1004 Madagascar Centella Tea-Trica BHA Foam 125ml",TTAZKBKQG,5,1172.3,0.18
"Máscara facial calmante Farmstay Cica Farm Regenerating Calming Mask 25ml 5 unidades",XEED9J6B3,5,426.88,0.06
"Protetor solar em bastão Celimax Oil Control Mattifying Sun Stick SPF/PA++++ 50+ 19g",BYTBEEBXE,5,859.57,0.13
"Máscara facial Etude House 0.2 Therapy Air Sheet Mask 20g Ceramide",XZMMKUXWD,5,62.99,0.01
"Máscara de LED Project E Beauty Lumamask Pro LED Light Therapy Face Mask",YX7W3V99V,5,16000,2.42
"Tônico facial para pele sensível SKIN1004 Madagascar Centella Quick Calming Toner Pad 70 Pads",BAUF8JKRK,5,1489.5,0.23
"Creme p/ olhos clareador e anti rugas Medi-Peel Peptide 9 Shrink Lif-Tox Eye Cream 20ml",AXFF9VUVE,5,1149.5,0.17
"Máscara facial Biodance Hydro Cera-Nol Real Deep Mask Sheet 3 unidades",B9QCTFWUA,5,949.66,0.14
"Balm Multifuncional Kahi Seoul Wrinkle Bounce Multi Balm 9g",HWQ9RPAR2,5,848.68,0.13
"Tônico facial para poros e cravos COSRX BHA Blackhead Power Liquid Essence 100ml",UKJ3THZZ8,5,1239.19,0.19
"Shampoo e tratamento LABO-H Scalp Strengthening Hair Loss e Scalp Capsule Treatment 400mlx200ml",PAERHBNQS,5,2180,0.33
"Base BB Cream Missha M Perfect Cover 50ml Nº 13 - Bege brilhante",CBWT99ZR3,5,808.62,0.12
"Tônico facial Cosrx Full Fit Propolis Synergy Toner 280ml",FS6YUEJTC,5,1440,0.22
"Máscara p/ olhos de retinol Mediheal Retinol Collagen Eye Patch",S8W2FFGBR,5,945,0.14
"Máscara facial Etude House 0.2 Therapy Air Sheet Mask 20g Collagen",ZAMSWWDSR,5,66,0.01
"Sérum amaciador de cravos ILSO Super Melting Serum Softener Pack Especial 150ml",W8RDJN4E6,5,1124.9,0.17
"Sérum de peptídeos MEDI-PEEL Peptide 9 Volume Essence 100ml Peptide 9 Volume Lifting",GNBZ8CZUR,5,1377.6,0.21
"Kit Teste TIRTIR Mask Fit Red Cushion Foundation Cushion com 1g 6 sachês Medium (25N á 31N)",GVY6VRHC3,5,896,0.14
"Sérum facial com retinal Celimax The Vita-A Retinol Shot Tightening Serum 30ml",4ZMW39AWH,5,1256.4,0.19
"Tônico facial Numbuzin Nº1 Centella Re-leaf Green Essence Toner Pad",5MHLW65YZ,5,1219.88,0.18
"Tônico facial de arroz I'm from Rice Toner Pad 60 pads",MBG8F2X7G,5,1499.95,0.23
"Sérum facial com peptídeos e bakuchiol EQQUALBERRY Bakuchiol Plumping Serum 30ml",2AHW8XZC2,5,1160.57,0.18
"Óleo de limpeza facial clareador Numbuzin Nº5+ Glutathione C Facial Spa Cleanser 200ml",N7DGUEMDY,5,1499.5,0.23
"Protetor solar Missha All-Around Safe Block Sunscream SPF45/50 Pa+++ 50ml e 70ml Cotton 50",MZ78ULF9Y,5,327.98,0.05
"Máscara facial Biodance Hydro Cera-Nol Real Deep Mask Sheet 1 unidade",3TQUAGPMS,5,432,0.07
"Ampola Facial SKIN1004 Madagascar Centella Poremizing Fresh Ampoule 50ml",NF36BPMQL,5,1108.6,0.17
"Tônico facial Numbuzin Nº4 Pore Zero Peeled Egg Essence Toner Pad",BXN9G4KEE,5,1374.85,0.21
"Espuma de limpeza facial ANUA Heartleaf Succinic Moisture Cleansing Foam 150ml",GRL2MCLEZ,5,1080,0.16
"Dispositivo de tratamento facial Medicube Age-R Booster H",FZMSEJB33,5,14262.8,2.16
"Sérum de peptídeos MEDI-PEEL Peptide 9 Volume Essence 100ml Volume Essence All in One",CG3R4YXGY,5,1347.6,0.2
"Creme hidratante facial calmante Some By Mi Propolis B5 Glow Barrier Calming Cream 60g",NZ3WWRYVV,4,1099.88,0.17
"Protetor solar facial líquido Supergoop Unseen e Glow Sunscreen Broad Spectrum Sunscreen SPF 40 PA+++ Glow",PN97K5W72,4,905.4,0.14
"Tônico facial calmante Abib Heartleaf Spot Toner Pad",9BP4ZKJ8U,4,1099.87,0.17
"Sérum facial com microagulhamento VT Cosmetics Sangue de Dragão Red Booster Reedle Shot 100/300/700 50ml 300",X7AUGMFMC,4,1800,0.27
"Base Cushion TIRTIR Mask Fit AI Filter Cushion 18g 17C Porcelain",6D7H9U972,4,1199.2,0.18
"Tônico facial calmante Some By Mi Propolis B5 Glow Barrier Calming Toner 150ml",TQ7ELDMHR,4,740.28,0.11
"Base BB Cream Missha M Perfect Cover 50ml Nº 21 - Bege claro",72P3ZQFSY,4,599.6,0.09
"Protetor solar líquido com ácido hialurônico Instree Hyaluronic Acid Watery Sun Gel 50ml",DXU6QWNXN,4,582.66,0.09
"Tônico facial TIRTIR Milk Skin Toner Original e Light 150ml Original",WHBXYPNXX,4,960,0.15
"Sérum facial The Ordinary Niacinamida 10% + Zinco 1% 30ml",6TMUY4QPM,4,633.02,0.1
"Tônico Mediheal Toner Pads Turquesa - Madecassoside blemish",NP93HRNZY,4,928.2,0.14
"Sérum com Vitamina C Anua Green Lemon Vita C Blemish Serum 20ml",KZ23X3LLC,4,1089.7,0.16
"Tônico facial clareador com vitamina c Abib Glutathiosome Dark Spot Pad 60 pads 220ml",HYUPFZR9H,4,1200,0.18
"Tônico facial Mediheal Toner Pads 170ml Rosa - Collagen Ampoule",SN4CFWTM5,4,1147,0.17
"Base BB Cream Missha M Perfect Cover 50ml Nº 23 - Bege natural",Q22B8ELXV,4,666.8,0.1
"Tônico Mediheal Toner Pads Marrom - Retinol Collagen Lifting",VVH5TXF8A,4,1118,0.17
"Máscara p/ olhos de mucina de caracol COSRX Advanced Snail Hydrogel Eye Patch",W3U2REUWQ,4,799.99,0.12
"Protetor solar líquido facial Haruharu Wonder Black Rice Moisture Airyfit Pure Mineral Relief Daily 50ml Black Rice Moisture Airyfit",FRBD8JBEN,4,677.46,0.1
"Sérum facial e Mist d'Alba White Truffle First Spray Serum 100ml",BSY3UHXD2,4,1034.62,0.16
"Sérum facial I'm From Rice 30ml",XSDT9P72U,4,773.3,0.12
"Protetor solar facial Bioré Perfect Milk UV FPS50 40ml",BNW8DKB65,4,300,0.05
"Máscara facial Etude House 0.2 Therapy Air Sheet Mask 20g Tea Tree",EWA76X3ET,4,33,0
"Sérum facial com microagulhamento VT Cosmetics Sangue de Dragão Red Booster Reedle Shot 100/300/700 50ml 700",J8MTQER4R,4,1977,0.3
"Sérum facial I'm From Rice 30ml",XSDT9P72U,4,773.3,0.12
"Tônico Mediheal Toner Pads Turquesa - Madecassoside blemish",NP93HRNZY,4,928.2,0.14
"Creme p/ olhos Fraijour Retin Collagen 3D Core Eye Cream 15ml",MS2FF2WDE,4,367.54,0.06
"Tônico facial calmante Abib Heartleaf Spot Toner Pad",9BP4ZKJ8U,4,1099.87,0.17
"Protetor solar líquido facial Haruharu Wonder Black Rice Moisture Airyfit Pure Mineral Relief Daily 50ml Black Rice Moisture Airyfit",FRBD8JBEN,4,677.46,0.1
"Base BB Cream Missha M Perfect Cover 50ml Nº 21 - Bege claro",72P3ZQFSY,4,599.6,0.09
"Sérum facial e Mist d'Alba White Truffle First Spray Serum 150ml",YFYE8RBRP,4,1353.24,0.2
"Protetor solar líquido House of Hur Weightless Sun Fluid 50ml",9AUY6MZLA,4,991.8,0.15
"Óleo capilar Kerasys Serum Extreme Damage Clinic 70ml",L6HZSE5D3,4,651.2,0.1
"Creme hidratante facial calmante Some By Mi Propolis B5 Glow Barrier Calming Cream 60g",NZ3WWRYVV,4,1099.88,0.17
"Base Cushion TIRTIR Mask Fit Red Cushion 18g e Mini 4.5g 18g 25N (Mocha)",F3M3T6XGE,4,1471.63,0.22
"Sérum facial calmante com colágeno Celimax The Real Noni Energy Ampoule 50ml",98DEKEA3E,4,891,0.13
"Creme hidratante facial anti-idade com PDRN Rejuran Healer Turnover Active Cream 50ml",C67STN2SB,4,1099.63,0.17
"Tônico facial TIRTIR Milk Skin Toner Original e Light 150ml Original",WHBXYPNXX,4,960,0.15
"Sérum facial calmante com colágeno Celimax The Real Noni Energy Ampoule 30ml",4YSB4WFGQ,4,851,0.13
"Base Cushion TIRTIR Mask Fit AI Filter Cushion 18g 23N Sand",66KDAJ2JZ,4,1109.26,0.17
"Creme hidratante facial Dr. Althea 147/345 Relief Barrier Cream 50ml 345 - Relief Cream",H3QDCSCZN,4,1259.9,0.19
"Óleo reparador capilar Mise En Scene Perfect Serum 80ml Watery",E33RUVS9J,4,702.22,0.11
"Kit Viagem para Acne e Espinhas Some by Mi AHA BHA PHA 30 Days Miracle SOS Kit",NSS2RET6U,4,966.73,0.15
"Sérum facial com Retinol e Vitamina C Primera AG.VCN  Youth Radiance Vitatinol Serum 21g",J232X26MY,4,1258.6,0.19
"Sérum com Vitamina C Anua Green Lemon Vita C Blemish Serum 20ml",KZ23X3LLC,4,1089.7,0.16
"Sérum facial com microagulhamento e colágeno Medicube PDRN Pink Collagen Exosome Shot Ampoule 2000 e 7500 30ml 7500ppm",3NVAEU5KV,4,1679.2,0.25
"Máscara facial Etude House 0.2 Therapy Air Sheet Mask 20g Green Tea",BTDZNWPEJ,4,59.98,0.01
"Sérum facial e Mist d'Alba White Truffle First Spray Serum 100ml",BSY3UHXD2,4,1034.62,0.16
"Tônico facial com colágeno Abib Jericho Rose Collagen Pad 60 pads",Z8S3J5RJP,4,1148.4,0.17
"Primer p/ maquiagem O.TWO.O Zero Pores 20ml",HN2DZ4QNG,4,630.72,0.1
"Máscara facial Etude House 0.2 Therapy Air Sheet Mask 20g Tea Tree",EWA76X3ET,4,33,0
"Sérum facial clareador Numbuzin Nº 5 Goodbye Blemish Serum 50ml",2LZ3WX2HD,4,1120.2,0.17
"Tônico facial SKINFOOD Acorn Pore Peptide Toner Pad 250g",F6ETPV7M3,3,809.7,0.12
"Base Cushion TIRTIR Mask Fit AI Filter Cushion 18g 24N Latte",G3Y93A9ZN,3,803.46,0.12
"Base Cushion TIRTIR Mask Fit Red Cushion 18g e Mini 4.5g 18g 13C (Fair)",MLHLK8WPJ,3,1199.7,0.18
"Protetor solar em bastão SKIN1004 Madagascar Centella Hyalu-Cica Silky Fit Sun Stick 20g",GYXLUFTSU,3,630,0.1
"Cleansing Balm CLEAN IT ZERO Banila Co 100g",FQ7UFNQNX,3,516,0.08
"Máscara Labial noturna Lip Sleeping Mask Apple Lime 20g",J2HY6Z4TM,3,480,0.07
"Creme p/ área dos olhos com retinal CKD Retinal 4X Guasha Eyecream 30ml",YF9P7833T,3,900,0.14
"Sérum facial firmador anti-idade Abib Jericho Rose Bifida Serum Firming Drop 50ml",DZZ242RYA,3,685.53,0.1
"Base Cushion TIRTIR Mask Fit Red Cushion 18g e Mini 4.5g 4.5g (Mini) 33N (Macchiato)",4FXRY2KRN,3,755.73,0.11
"Base Cushion TIRTIR Mask Fit Red Cushion 18g e Mini 4.5g 18g 24W (Soft Beige)",CFUMKQ4ZR,3,1071.73,0.16
"Tônico Mixsoon Soondy Centella Asiatica Essence 100ml",BPNK4P8K4,3,896.58,0.14
"Tônico facial Mediheal Toner Pads 170ml Roxo - PDRN Lifting",6YZFC3WLF,3,721,0.11
"Óleo de limpeza facial Bioré Cleansing Oil 150ml",6XLGXR2JV,3,202.73,0.03
"Creme hidratante reparador La Roche Posay Cicaplast Baume B5 100ml",ANGPHA6WR,3,660,0.1
"Creme hidratante calmante Torriden Balanceful Cica Cream 80ml",D44FBVQ5M,3,661.5,0.1
"Máscara facial Missha Airy Fit Sheet Mask Aloe",2K269J5WV,3,149.7,0.02
"Óleo reparador capilar Mise En Scene Perfect Serum 80ml Styling",V3FXNVY5G,3,453.63,0.07
"Sérum facial Vitamina C Goodal Green Tangerine Vita C Dark Spot Care Serum 40ml",G6C9ZNL22,3,798.9,0.12
"Sérum facial Innisfree Retinol Cica Repair Ampoule 30ml",EXRVU2789,3,1019.4,0.15
"Sérum facial calmante com ácido azeláico ANUA Azelaic Acid 15 Intense Calming Serum 30ml",KZBRX8Q9Z,3,1041,0.16
"Kit Experiência History of Whoo Gongjinhyang Soo Vital Mini Set",K959DAHYZ,3,488,0.07
"Base Cushion TIRTIR Mask Fit AI Filter Cushion 18g 21C Cool Ivory",W8H7SJSWN,3,899.4,0.14
"Sérum facial de retinol COSRX The Retinol 0.5 Oil 20ml",CQDP5XYPC,3,705,0.11
"Creme facial hidratante corretor de cor Dr. Jart+ Cicapair  Tiger Grass Color Correcting Treatment SPF 30 50ml",2F67SB6E8,3,908.3,0.14
"Tônico facial Some by Mi AHA-BHA-PHA 30 Days Miracle Toner 30ml",4F4QC79KU,3,453.9,0.07
"Base Cushion TIRTIR Mask Fit Red Cushion 18g e Mini 4.5g 18g 27N (Camel)",KNNWQT6T9,3,951.76,0.14
"Corretivo facial Tfit Cover Up Pro Concealer 15g Neutral",XKLK6A9BU,3,533,0.08
"Base Cushion TIRTIR Mask Fit AI Filter Cushion 18g 29N Natural Beige",4NMDMT3UR,3,803.46,0.12
"Óleo reparador capilar Mise En Scene Perfect Serum 80ml Super Rich",28BVC7BBN,3,502.32,0.08
"Sérum facial calmante Purito Seoul Wonder Releaf Centella Serum Unscented 60ml",QJ7WMPMDS,3,568.4,0.09
"Óleo reparador capilar Mise En Scene Perfect Serum 80ml Original",PKM9RE95F,3,444.78,0.07
"Base Cushion TIRTIR Mask Fit AI Filter Cushion 18g 22N Shell Beige",7ZHYQ8HAK,3,899.4,0.14
"Creme p/ olhos AHC Ten Revolution Real Eye Cream 30ml",9SL8EKKSE,3,370.95,0.06
"Tônico facial Cosrx AHA BHA Clarifying Treatment Toner 50ml",Z5Q86PWJU,3,284.3,0.04
"Tônico facial TIRTIR Milk Skin Toner Original e Light 150ml Light",EUU72QSFX,3,1093.42,0.17
"Sérum com Ácido Hialurônico Mixsoon Glacier Water Hyaluronic Acid Serum 100ml",CE5TEEU2B,3,886,0.13
